<?xml version="1.0" encoding="UTF-8"?>
<!--Sample XML file generated by XMLSpy v2005 rel. 3 U (http://www.altova.com)-->
<TaxonPageTemplates xmlns:xsi="http://www.w3.org/2001/XMLSchema-instance" xsi:noNamespaceSchemaLocation="TaxonPageTemplate.xsd">
	<TaxonPageTemplate xslFileName="marshabogs.xsl" datasourceName="marshaBogsData">
		<groups>
			<group rank="1" id="1">
				<characterValue rank="1" text="Field Guide to the Bogs of Southern New England"/>
				<characterValue rank="2" text="by Marsha Salett"/>
			</group>
			<group rank="2" id="2" label="Taxonomy"/>
			<group rank="1" id="3">
				<characterValue rank="1" value="Common Name"/>
				<characterValue rank="2"/>
				<characterValue rank="3"/>
				<characterValue rank="4" value="Genus"/>
				<characterValue rank="5" value="Species"/>
				<characterValue rank="6" value="Author"/>
				<characterValue rank="7" value="Family"/>
				<characterValue rank="8" value="Family Common Name"/>
			</group>
			<group rank="2" id="4">
				<characterValue rank="1" value="Main Image"/>
			</group>
			<group rank="3" id="5">
				<characterValue rank="1" label="Synonyms" value="Common Name Synonyms"/>
			</group>
			<group rank="4" id="5">
				<characterValue rank="1" label="Description" value="Description"/>
				<characterValue rank="2" value="Description Images"/>
			</group>
			<group rank="5" id="5">
				<characterValue rank="1" label="Wetland indicator status" value="Wetland indicator status"/>
			</group>
			<group rank="6" id="5">
				<characterValue rank="1" label="Leaves" value="Leaves"/>
				<characterValue rank="2" value="Leaves Images"/>
			</group>
			<group rank="7" id="5">
				<characterValue rank="1" value="Flowers" label="Flowers"/>
				<characterValue rank="2" value="Flowers Images"/>
			</group>
			<group rank="8" id="5">
				<characterValue rank="1" value="Flowering Period" label="Flowering Period"/>
			</group>
			<group rank="9" id="5">
				<characterValue rank="1" value="Fruit" label="Fruit"/>
				<characterValue rank="2" value="Fruit Images"/>
			</group>
			<group rank="10" id="5">
				<characterValue rank="1" value="Fruiting Period" label="Fruiting Period"/>
			</group>
			<group rank="11" id="5">
				<characterValue rank="1" value="Habitat" label="Habitat"/>
			</group>
			<group rank="12" id="5">
				<characterValue rank="1" value="Range" label="Range"/>
			</group>
			<group rank="13" id="5">
				<characterValue rank="1" value="Associates" label="Associates"/>
			</group>
			<group rank="14" id="5">
				<characterValue rank="1" value="Similar Species" label="Similar Species"/>
				<characterValue rank="2" value="Similar Species Images" label="Similar Species Captions"/>
			</group>
			<group rank="15" id="5">
				<characterValue rank="1" value="Seasonal Diagnostics" label="Seasonal Diagnostics"/>
				<characterValue rank="2" value="Seasonal Diagnostics Images"/>
			</group>
			<group rank="16" id="6">
				<characterValue rank="1" text="(c) 1998-2006 Marsha Salett"/>
			</group>
		</groups>
	</TaxonPageTemplate>
</TaxonPageTemplates>
